{
  "$schema": "https://json-schema.org/draft/2020-12/schema",
  "$id": "https://tiktok-shop-video-ai.local/schemas/tiktok-publication.schema.json",
  "title": "TikTok Publication",
  "description": "Registro técnico de UMA tentativa de publicação via TikTok Content Posting API (Direct Post), produzido exclusivamente por tiktok-publishing-subagent — hoje `tools: none`, desativado (ver publishing-agent.md). Espelha o papel de creatify-job.schema.json na camada de geração: é a única camada da pipeline que conhece detalhes técnicos da API de publicação do TikTok. Fase 18: schema criado por completude estrutural, NENHUMA publicação real foi feita e este schema não é produzido por nenhum agente ativo ainda. Ver pipeline/orchestration/TIKTOK-ARCHITECTURE.md para CONFIRMED/NOT CONFIRMED.",
  "type": "object",
  "required": ["schema_version", "project_id", "created_at", "platform", "internal_status", "provider_status"],
  "properties": {
    "schema_version": { "type": "string", "const": "1.0.0" },
    "project_id": { "type": "string" },
    "created_at": { "type": "string", "format": "date-time" },
    "platform": { "type": "string", "const": "tiktok" },
    "platform_account_ref": {
      "type": ["string", "null"],
      "description": "Referência a um registro platform-account.schema.json com oauth_status=connected para a conta que está publicando."
    },
    "video_source_ref": {
      "type": "string",
      "description": "Referência ao vídeo final aprovado (asset_id de asset-manifest.json ou video-manifest.json), já com qa-report.status=approved e aprovação humana de publicação registrada."
    },
    "source_method": {
      "type": "string",
      "enum": ["pull_from_url", "file_upload"],
      "description": "Método de transferência do vídeo — CONFIRMADO DOCUMENTALMENTE que a Direct Post API suporta ambos (PULL_FROM_URL e FILE_UPLOAD). Ver TIKTOK-ARCHITECTURE.md."
    },
    "post_info": {
      "type": "object",
      "description": "Espelha os campos documentados de post_info da Direct Post API — nomes exatamente como confirmados na documentação, nunca inventados.",
      "properties": {
        "privacy_level": {
          "type": "string",
          "enum": ["PUBLIC_TO_EVERYONE", "MUTUAL_FOLLOW_FRIENDS", "FOLLOWER_OF_CREATOR", "SELF_ONLY"],
          "description": "CONFIRMADO DOCUMENTALMENTE. Enquanto o app não passar pela auditoria da TikTok, só SELF_ONLY (modo privado) é aceito na prática — ver app_review_status em platform-account.schema.json."
        },
        "title": { "type": "string", "maxLength": 2200 },
        "disable_duet": { "type": "boolean" },
        "disable_stitch": { "type": "boolean" },
        "disable_comment": { "type": "boolean" },
        "is_aigc": {
          "type": "boolean",
          "description": "Disclosure de conteúdo gerado por IA — campo documentado (`is_aigc`). Como todo vídeo desta pipeline passa pelo Creatify, este campo deve ser `true` sempre que uma publicação real for registrada."
        }
      }
    },
    "external_publication_id": {
      "type": ["string", "null"],
      "description": "ID retornado pela TikTok na criação da publicação. Nulo até a submissão ser aceita."
    },
    "provider_status": {
      "type": "string",
      "description": "Status bruto retornado pela TikTok Content Posting API para esta publicação. Vocabulário exato NÃO totalmente confirmado nesta fase (a página de 'Get Post Status' foi referenciada mas não verificada em detalhe) — registrar literalmente o que a API retornar, nunca normalizar para outro vocabulário."
    },
    "internal_status": {
      "type": "string",
      "enum": ["not_authorized", "planned", "human_approved", "submitted", "processing", "published_private", "published_public", "failed", "cancelled"],
      "description": "Modelo de estado interno, independente da API do TikTok. 'published_private' é o único estado de sucesso esperado até que o app tenha app_review_status=approved."
    },
    "submitted_at": { "type": ["string", "null"], "format": "date-time" },
    "completed_at": { "type": ["string", "null"], "format": "date-time" },
    "human_publication_approval": {
      "type": ["object", "null"],
      "description": "Aprovação humana de PUBLICAÇÃO — distinta da aprovação de geração em generation-plan.json. Nulo até um humano aprovar explicitamente. tiktok-publishing-subagent recusa execução se este campo estiver nulo (mesmo princípio de generation-plan.json.approval).",
      "properties": {
        "approved_by": { "type": "string" },
        "approved_at": { "type": "string", "format": "date-time" }
      },
      "required": ["approved_by", "approved_at"]
    },
    "failure_reason": { "type": ["string", "null"] },
    "error_code": {
      "type": ["string", "null"],
      "description": "Código de erro literal retornado pela API, quando houver (ex.: 'unaudited_client_can_only_post_to_private_accounts' — CONFIRMADO DOCUMENTALMENTE como um erro real desta API)."
    },
    "simulation_note": {
      "type": ["string", "null"],
      "description": "Preenchido apenas em dry-runs estruturais: deve conter literalmente 'SIMULATED — NOT REAL — NO EXTERNAL API CALL' quando este registro não corresponde a uma publicação real. Null em qualquer execução real."
    }
  },
  "additionalProperties": false
}
