{
  "schema_version": "1.0.0",
  "project_id": "dry-run-002",
  "created_at": "2026-09-22T14:50:00Z",
  "platform": "tiktok",
  "platform_account_ref": "SIMULATED — nenhum platform-account.json real existe; representaria uma conta TikTok Business conectada via OAuth",
  "video_source_ref": "asset-01 (asset-manifest.json, dry-run-002)",
  "source_method": "pull_from_url",
  "post_info": {
    "privacy_level": "SELF_ONLY",
    "title": "SIMULATED — Sua mesa ainda tem aquela luz horrível? #ProdutoFicticio #dryrun002",
    "disable_duet": false,
    "disable_stitch": false,
    "disable_comment": false,
    "is_aigc": true
  },
  "external_publication_id": "SIMULATED-post-id-999222",
  "provider_status": "SIMULATED — vocabulário exato de status não confirmado na Fase 18; valor inventado para teste estrutural",
  "internal_status": "published_private",
  "submitted_at": "2026-09-22T14:50:05Z",
  "completed_at": "2026-09-22T14:50:30Z",
  "human_publication_approval": {
    "approved_by": "SIMULATION (dry-run-002) — nenhum humano real aprovou isto; teste estrutural apenas",
    "approved_at": "2026-09-22T14:49:00Z"
  },
  "failure_reason": null,
  "error_code": null,
  "simulation_note": "SIMULATED — NOT REAL — NO EXTERNAL API CALL. privacy_level forçado a SELF_ONLY porque nenhum app TikTok Developer foi auditado (nem sequer existe) — mesmo nesta simulação, a regra de app não-auditado foi respeitada para não normalizar um estado que seria impossível numa execução real."
}
